{
  "schema_version": "1.0.0",
  "project": {
    "project_id": "PROJECT-{{PROJECT_PREFIX}}",
    "name": "{{PROJECT_NAME}}",
    "stage": "Development",
    "task_list_id": "TASKLIST-{{PROJECT_PREFIX}}-001",
    "generated_for": "AI Coding atomic task execution"
  },
  "phases": [],
  "tasks": []
}
